url,status,title,title_length,meta_desc,meta_desc_len,canonical,h1,word_count,headings_count,has_featured_image,internal_links,external_links,images,images_with_alt,mixed_content,publish_date,categories,content_quality_score,readability_score,has_og_image,has_schema_markup
https://spherevista360.com,200,- Your 360° View on Global Insights,35,Your 360° View on Global Insights,33,https://spherevista360.com/,Explore the World of 360-Degree Visuals,42,10,no,22,0,0,0,no,"October 9, 2025",,40.0,Hard,no,yes
https://spherevista360.com/category/travel/,200,Category: Travel -,18,,0,https://spherevista360.com/category/travel/,Travel,40,3,no,12,0,0,0,no,"October 8, 2025","Skip to content, , Home, Finance, World, Travel, Politics, Entertainment, Technology, Business, Newsletter – SphereVista360 Insights, , Smart Itineraries with AI: Plan Trips in Hours, Not Weeks, Smart Itineraries with AI: Plan Trips in Hours, Not WeeksRead Post », Digital Nomad Visas 2025: Work from Anywhere, Digital Nomad Visas 2025: Work from AnywhereRead Post », Top Visa-Free Destinations for 2025 Travelers, Top Visa-Free Destinations for 2025 TravelersRead Post »",40.0,Hard,no,yes
https://spherevista360.com/us-india-trade-2025/,200,US-India Trade Relations 2025: Strategic Partnership and Economic Opportunities -,81,"Comprehensive analysis of US-India trade relationship, emerging opportunities, challenges, and strategic implications for global commerce in 2025.",146,https://spherevista360.com/us-india-trade-2025/,US-India Trade Relations 2025: Strategic Partnership and Economic Opportunities,245,9,no,16,0,2,1,no,"October 9, 2025","Uncategorized, Uncategorized, Uncategorized",65.0,Hard,no,yes
https://spherevista360.com/global-inflation-2025/,200,Global Inflation Outlook 2025: Economic Trends and Policy Responses -,69,"Comprehensive analysis of global inflation trends, central bank policies, economic impacts, and strategic considerations for businesses and investors in 2025.",158,https://spherevista360.com/global-inflation-2025/,Global Inflation Outlook 2025: Economic Trends and Policy Responses,211,8,no,16,0,2,1,no,"October 9, 2025","Uncategorized, Uncategorized, Uncategorized",65.0,Hard,no,yes
https://spherevista360.com/visa-free-destinations-2025/,200,Visa-Free Travel Destinations: Complete 2025 Guide for Global Travelers -,73,"Comprehensive guide to visa-free travel opportunities, destination rankings, travel requirements, and strategic tips for passport optimization in 2025.",151,https://spherevista360.com/visa-free-destinations-2025/,Visa-Free Travel Destinations: Complete 2025 Guide for Global Travelers,264,11,no,15,0,2,1,no,"October 9, 2025","Uncategorized, Uncategorized, Uncategorized",65.0,Hard,no,yes
https://spherevista360.com/category/world/,200,Category: World -,17,,0,https://spherevista360.com/category/world/,World,32,4,no,13,0,0,0,no,"October 8, 2025","Skip to content, , Home, Finance, World, Travel, Politics, Entertainment, Technology, Business, Newsletter – SphereVista360 Insights, , Supply Chain Reshoring: How 2025 Changes Everything, Supply Chain Reshoring: How 2025 Changes EverythingRead Post », Global Digital Identity: Cross-Border Logins & Payments, Global Digital Identity: Cross-Border Logins & PaymentsRead Post », Global Elections 2025: Shifting Political Dynamics, Global Elections 2025: Shifting Political DynamicsRead Post », US–India Trade Relations: A New Era of Cooperation, US–India Trade Relations: A New Era of CooperationRead Post »",40.0,Hard,no,yes
https://spherevista360.com/startup-funding-2025/,200,Startup Funding Landscape: What Investors Want in 2025 -,56,"Comprehensive analysis of startup funding trends, investor preferences, valuation metrics, and strategic guidance for entrepreneurs seeking investment in 2025.",159,https://spherevista360.com/startup-funding-2025/,Startup Funding Landscape: What Investors Want in 2025,201,8,no,16,0,1,0,no,"October 9, 2025","Uncategorized, Uncategorized, Uncategorized",60.0,Hard,no,yes
https://spherevista360.com/category/business/,200,Category: Business -,20,"This is an example text of category description. Lorem ipsum dolor sit amet, consectetur adipisicing elit. Minima incidunt voluptates nemo, dolor optio quia architecto quis delectus perspiciatis. Nobis atque id hic neque possimus voluptatum voluptatibus tenetur, perspiciatis consequuntur.",289,https://spherevista360.com/category/business/,Business,32,2,no,11,0,0,0,no,"October 8, 2025","Skip to content, , Home, Finance, World, Travel, Politics, Entertainment, Technology, Business, Newsletter – SphereVista360 Insights, , Ops Copilots: Automating Work That Scales Businesses, Ops Copilots: Automating Work That Scales BusinessesRead Post », Startup Funding Trends and Investor Sentiment in 2025, Startup Funding Trends and Investor Sentiment in 2025Read Post »",35.0,Hard,no,yes
https://spherevista360.com/category/finance/,200,Category: Finance -,19,,0,https://spherevista360.com/category/finance/,Finance,39,5,no,14,0,0,0,no,"October 8, 2025","Skip to content, , Home, Finance, World, Travel, Politics, Entertainment, Technology, Business, Newsletter – SphereVista360 Insights, , Green Bonds in Energy Transition: Where Yields Make Sense, Green Bonds in Energy Transition: Where Yields Make SenseRead Post », AI Agents in Retail Investing: What Actually Works in 2025, AI Agents in Retail Investing: What Actually Works in 2025Read Post », Digital Banking Revolution: The Future of FinTech, Digital Banking Revolution: The Future of FinTechRead Post », Rising Inflation and Its Impact on Emerging Markets, Rising Inflation and Its Impact on Emerging MarketsRead Post », How AI Is Transforming Global Investing in 2025, How AI Is Transforming Global Investing in 2025Read Post »",40.0,Hard,no,yes
https://spherevista360.com/newsletter/,200,Newsletter -,12,"Subscribe to SphereVista360 newsletter for weekly insights on entertainment, technology, finance, and global affairs. Join thousands of informed readers today.",159,https://spherevista360.com/newsletter/,Newsletter,241,7,no,20,0,3,3,no,2025-10-07T01:03:59+00:00,,75.0,Hard,no,yes
https://spherevista360.com/budget-travel-tips-2025/,200,Smart Budget Travel Strategies: Money-Saving Tips for 2025 -,60,"Comprehensive guide to budget travel in 2025, featuring money-saving strategies, digital tools, and insider tips for affordable adventures.",139,https://spherevista360.com/budget-travel-tips-2025/,Smart Budget Travel Strategies: Money-Saving Tips for 2025,195,8,no,16,0,1,0,no,"October 9, 2025","Uncategorized, Uncategorized, Uncategorized",60.0,Hard,no,yes
https://spherevista360.com/global-elections-2025/,200,Global Elections 2025: Key Democratic Processes Shaping the World -,67,"Comprehensive analysis of major global elections in 2025, their potential impact on international relations, and democratic trends worldwide.",141,https://spherevista360.com/global-elections-2025/,Global Elections 2025: Key Democratic Processes Shaping the World,210,8,no,16,0,2,1,no,"October 9, 2025","Uncategorized, Uncategorized, Uncategorized",65.0,Hard,no,yes
https://spherevista360.com/page/6/,200,- Your 360° View on Global Insights - Page 6 of 6,49,Your 360° View on Global Insights,33,https://spherevista360.com/page/6/,Explore the World of 360-Degree Visuals,34,3,no,14,0,0,0,no,"October 6, 2025",,40.0,Hard,no,yes
https://spherevista360.com/open-source-models-2025/,200,Open-Source AI Models in Enterprise: Complete 2025 Implementation Guide -,73,"Comprehensive guide to implementing open-source AI models in enterprise environments, covering benefits, challenges, security considerations, and best practices.",161,https://spherevista360.com/open-source-models-2025/,Open-Source AI Models in Enterprise: Complete 2025 Implementation Guide,187,8,no,16,0,1,0,no,"October 9, 2025","Uncategorized, Uncategorized, Uncategorized",60.0,Hard,no,yes
https://spherevista360.com/ai-in-politics/,200,AI in Politics: Technology Reshaping Democratic Processes in 2025 -,67,"Comprehensive analysis of how artificial intelligence is transforming political campaigns, governance, public policy, and democratic engagement in 2025.",152,https://spherevista360.com/ai-in-politics/,AI in Politics: Technology Reshaping Democratic Processes in 2025,194,8,no,16,0,1,0,no,"October 9, 2025","Uncategorized, Uncategorized, Uncategorized",60.0,Hard,no,yes
